address,categories/0,city,countryCode,isAdvertisement,isLocalGuide,name,publishAt,publishedAtDate,stars,text,totalScore,language,sentiment
"7295 King Faisal Rd، 3205, Riyadh 13711, Saudi Arabia",Tourist attraction,Riyadh,SA,False,True,Shabbir Husain,a month ago,2024-08-25T11:50:51.473Z,5.0,"Awesome experience of Bujairi terrace, a rich heritage and culture of Saudi Arabia in serene settings, lush green gardens, and a natural environment.

It has lots of beautiful high-end fine dining restaurants and cafes.

Come explore with your friends and family.",4.6,en,5 stars
"7295 King Faisal Rd، 3205, Riyadh 13711, Saudi Arabia",Tourist attraction,Riyadh,SA,False,True,Kaptain Guzzy,5 days ago,2024-09-28T05:30:06.255Z,4.0,"Lovely collection of restaurants, eateries and gift shops opposite At-Turaif/Diriyah historical site. Serene and beautiful in the evening and night when the whole area is all lit up. Romantic even! Definitely worth eating at or simply relaxing over a coffee in the evenings. Note that to get into the site (the same ticket for entry into both the Bujari Terrace and the site - as you get to the historical site VIA Bujairi Terrace) is free if you book your ticket before 5pm; after that it is SAR 50 (but you can use this against anything you eat at any of the restaurants at the Terrace).",4.6,en,5 stars
"7295 King Faisal Rd، 3205, Riyadh 13711, Saudi Arabia",Tourist attraction,Riyadh,SA,False,True,M-S Shaikh,a week ago,2024-09-23T15:18:37.758Z,5.0,"Bujairi Al-Turaif is a very luxurious restaurant and guest house located in Diriyah, near the Diriyah World Heritage Site. Both the restaurant and the heritage site share a nearby gate for entry. It is an incredibly beautiful and luxurious place, and I've had a great experience every time I've visited. I've been there multiple times, and each visit offers a new experience. It's a wonderful place, perfect for spending time and attending events. I really enjoy going there; it’s always a delightful experience.

Diriyah Al-Turaif is a very important and historic place for Saudi Arabia. It is the site where the foundation of Saudi Arabia was laid in 1727, and since then, the Al Saud family has ruled the country. Diriyah holds great significance not only for the Saudi government but also for the Saudi public and the people. It is a place that must always be preserved and cherished, and it will always be remembered as a landmark of historical importance.",4.6,en,5 stars
"7295 King Faisal Rd، 3205, Riyadh 13711, Saudi Arabia",Tourist attraction,Riyadh,SA,False,True,Joferd Pineda,3 days ago,2024-09-29T17:03:50.947Z,5.0,"A great place to enjoy the peaceful nature specially during Sunday and monday as its less crowded. The place is filled with cafes, restaurants and food stalls to choose from. Sitting next to it is Diriyah which is the foundation of the kingdom. One of the UNESCO world heritage.

You have to book an entrance ticket to enter the area which cost 50SAR per person which you can redeem on any establishment youll spend money from.",4.6,en,5 stars
"7295 King Faisal Rd، 3205, Riyadh 13711, Saudi Arabia",Tourist attraction,Riyadh,SA,False,True,Afif Chougle,a week ago,2024-09-22T06:06:44.686Z,5.0,Amazing experience! We had lots of fun walking the entire path and viewing the historical artifacts. Wonderful insight into the oldest part of Saudi Arabia and it's history. Will definitely visit again.,4.6,en,5 stars
"7295 King Faisal Rd، 3205, Riyadh 13711, Saudi Arabia",Tourist attraction,Riyadh,SA,False,True,Amrita Nair,4 months ago,2024-05-15T07:53:44.106Z,5.0,"What an amazing place to visit to immerse yourself in the beauty of Saudi.Surrounded by lush green gardens it feels like an oasis. Visited before 5 pm and i didn’t have to pay for any entry ticket. This place has multiple cafés on both sides. There is a museum showing the rich heritage of Saudi, camel museum, few other small museums to enjoy,  huge forts to walk around & enjoy the beauty of this place. Tour guides are also available for a detailed orientation. Felt blessed to witness the sunset too. Could be uncomfortable to visit during summer but is a perfect spot anytime to visit during winters. Team is super helpful, sweet and so welcoming ! Must visit place when in Saudi.",4.6,en,5 stars
"7295 King Faisal Rd، 3205, Riyadh 13711, Saudi Arabia",Tourist attraction,Riyadh,SA,False,True,Dhay S,3 months ago,2024-07-01T09:15:20.490Z,4.0,"Such good, romantic atmosphere. Went here for dinner in winter and we loved it! Just a bit sad that you have to pay now to access but still the beauty of the whole area makes it worth it. The parking space is also not too far from Bujairi which I was a bit worried about before going there. Plus points for being able to access At-Turaif World Heritage Site. I would highly recommend visiting here during the fall or winter season, especially in the evenings.",4.6,en,4 stars
"7295 King Faisal Rd، 3205, Riyadh 13711, Saudi Arabia",Tourist attraction,Riyadh,SA,False,True,Byron,5 months ago,2024-04-23T06:44:29.754Z,5.0,"Diriyah and Bujairi are definitely a must-visit. They exude historical charm and offer a traditional atmosphere. This place is amazing in every detail. There is an entrance fee after 5pm, which can be redeemed at any restaurant there. Avoid booking tickets directly from the restaurants, as you will not have the choice to use your ticket at other restaurants. There are two parking lots located 10 minutes away, within walking distance from the entrance. It is a must-visit destination!",4.6,en,5 stars
"7295 King Faisal Rd، 3205, Riyadh 13711, Saudi Arabia",Tourist attraction,Riyadh,SA,False,True,Isa Ali,2 weeks ago,2024-09-14T08:47:08.685Z,5.0,"Bujairi Terrace is a must-visit, especially on a beautiful day! The views are absolutely stunning, with the perfect blend of historic charm and modern luxury. The outdoor seating lets you soak in the incredible scenery while enjoying delicious food. Service was excellent, and the ambiance was peaceful yet vibrant. It's a great spot to unwind, whether for a casual coffee or a full meal. Highly recommended if you're looking for a memorable experience in Riyadh!",4.6,en,5 stars
"7295 King Faisal Rd، 3205, Riyadh 13711, Saudi Arabia",Tourist attraction,Riyadh,SA,False,True,Silvia Pfeiffer,4 months ago,2024-05-10T05:05:12.842Z,5.0,It's an excellent location to learn about Saudi history and see some of the ways in which traditional buildings have been built. There are also amazing restaurants. It's a great place to go late afternoon and sirens a couple of hours before having dinner.,4.6,en,5 stars
"7295 King Faisal Rd، 3205, Riyadh 13711, Saudi Arabia",Tourist attraction,Riyadh,SA,False,True,manoj zinzuwadia,a month ago,2024-08-27T09:25:15.290Z,5.0,"Bujairi Terrace is the new premium fine dining destination for food lovers in the heart of the historical Diriyah district in Riyadh. As part of the Bujairi Terrace project, the terrace boasts over 21 world-renowned restaurants that furnish visitors with exquisite international cuisines along with a wide variety of local traditional dishes in a truly beautiful setting.",4.6,en,5 stars
"7295 King Faisal Rd، 3205, Riyadh 13711, Saudi Arabia",Tourist attraction,Riyadh,SA,False,True,Huzefa Bangdiwala,a week ago,2024-09-19T16:55:13.335Z,5.0,"The birth place of Saud Dynasty of Saudi Arabia.

Amazing restoration of the old Palace with beautiful landscaping. They have tours of the facility. Also have beautiful lightings in the evening with audio visual projection on the palace narrating the history of old to modern day Riyadh.

Plus there are multiple premium restaurants to take your guests to give an ever lasting memory of their Riyadh visit.

There is a 100 riyal entrance fees which can be used as credit in any restaurants.

A highly recommended must visit in Riyadh!",4.6,en,5 stars
"7295 King Faisal Rd، 3205, Riyadh 13711, Saudi Arabia",Tourist attraction,Riyadh,SA,False,True,Ibrahim Hajjar,5 months ago,2024-04-13T05:07:41.151Z,5.0,"Historical cultural monuments and generally human-centric oriented approach of the urban development for the whole region over there. Joyful attractions and great views. Great opportunity to discover the history of regional core Saudi Arabia, Historical Diriyah.
Recommended for families with children to visit and enjoy the facilities and activities each season. Buy your tickets in advance online in order to prevent any potential inconvenience. You may get the tickets with discount based on your purchase.",4.6,en,5 stars
"7295 King Faisal Rd، 3205, Riyadh 13711, Saudi Arabia",Tourist attraction,Riyadh,SA,False,True,Ayman Alrajab,3 months ago,2024-06-26T21:14:25.959Z,5.0,"It is a great historical place in Diriyah. just visit to see the true heart of Saudi Arabia.

Very welcoming place and is by far the best in the city.

Make sure to get your pass before you come",4.6,en,5 stars
"7295 King Faisal Rd، 3205, Riyadh 13711, Saudi Arabia",Tourist attraction,Riyadh,SA,False,True,Muhammad Ali Javed,5 months ago,2024-04-28T08:20:13.638Z,3.0,One of the recent additions to Riyadh tourist destination. This area houses multiple fine dining restaurants and also some open air cafes. One can enjoy the food with good view and vibes. But the restaurants are quite expensive with nothing much special to offer except the area vibes and cool pictures. Usually more crowded on weekends and specially in evening time.,4.6,en,4 stars
"7295 King Faisal Rd، 3205, Riyadh 13711, Saudi Arabia",Tourist attraction,Riyadh,SA,False,True,AksH Aya N,6 months ago,2024-03-28T12:32:04.078Z,5.0,"Very nice place to explore with friends as well as families. This place provides us with a time travel experience. It gives a picture of Saudi Arabia's old kings fort. Very clean and they arranged very well. Tickets cost 50 per person, but the advantage is we can spend that 50 SAR that we paid for the ticket in the cafe or restaurants there. It's a very nice thing that i feel good. Registration is done only through online mode. Recommend to everyone who is visiting Riyadh",4.6,en,4 stars
"7295 King Faisal Rd، 3205, Riyadh 13711, Saudi Arabia",Tourist attraction,Riyadh,SA,False,True,Reshma Vora (TheRealPakora),a week ago,2024-09-24T17:27:44.958Z,5.0,"Beautiful UNESCO site with the history of Saudi. I bring all my visitors here, a truely amazing place",4.6,en,5 stars
"7295 King Faisal Rd، 3205, Riyadh 13711, Saudi Arabia",Tourist attraction,Riyadh,SA,False,True,WPE Swanborn,a month ago,2024-08-14T17:52:55.134Z,5.0,Always a delight ! Very well reconstructed with a very good fast for lightning … in the evening it looks almost more beautiful  than during the day !,4.6,en,5 stars
"7295 King Faisal Rd، 3205, Riyadh 13711, Saudi Arabia",Tourist attraction,Riyadh,SA,False,True,Ahsan Waseem,a week ago,2024-09-25T15:45:07.553Z,5.0,"Need Entry Pass, all restaurants are fine dine ambience of this place is very nice",4.6,en,5 stars
"7295 King Faisal Rd، 3205, Riyadh 13711, Saudi Arabia",Tourist attraction,Riyadh,SA,False,True,Aysha Mahmood,3 months ago,2024-06-21T00:21:16.660Z,5.0,"The essence that the community has kept of this terrace is fabulous. The old ruins around the town have been complimented so well by the new construction.
There is live music in the evening when we were there and they have so many selection of restaurants to chose from. This was just a very clean, lovely easy place to take a walk and eat and enjoy as the sun set after a nice long day in Saudi",4.6,en,5 stars
"3718, 8793 - King Khalid International Airport - Unit No.1 Riyadh 13413 3718, Saudi Arabia",Shopping mall,Riyadh,SA,False,True,Louis Lee Bastareche,a week ago,2024-09-19T19:56:03.452Z,5.0,"This is a fantastic destination for shopping, hanging out, and enjoying a variety of activities. With a wide selection of shops, it's perfect for a family night out. They even offer exciting outdoor activities and provide excellent customer service.",4.5,en,5 stars
"3718, 8793 - King Khalid International Airport - Unit No.1 Riyadh 13413 3718, Saudi Arabia",Shopping mall,Riyadh,SA,False,True,Jonatan Minier,a month ago,2024-08-31T10:55:52.539Z,5.0,"Visit this mall with the family yesterday, the kids like it very much. As they were able to play and run around in the open area, there's all sorts of stores in this mall and the restaurants list is too long to write, but rest assured there's plenty, steak, Asian, Italian, local, coffee shops, you will not leave hungry.",4.5,en,4 stars
"3718, 8793 - King Khalid International Airport - Unit No.1 Riyadh 13413 3718, Saudi Arabia",Shopping mall,Riyadh,SA,False,True,Anas AlSurmi,4 months ago,2024-05-22T11:55:17.525Z,5.0,"I recently attended the food fair and was impressed by the experience. It featured a wide variety of brands, offering something for everyone. The event was well-organized, making it easy to navigate and enjoy all the offerings.",4.5,en,5 stars
"3718, 8793 - King Khalid International Airport - Unit No.1 Riyadh 13413 3718, Saudi Arabia",Shopping mall,Riyadh,SA,False,True,Mohamed Ajmal,3 months ago,2024-06-17T18:41:00.018Z,5.0,one of the posh shopping mall in Riyadh. one of its kind with indoor and outdoor shopping as well as dine in experience. well maintained and kids friendly. Great place for outdoor photography. premium restaurants.,4.5,en,5 stars
"3718, 8793 - King Khalid International Airport - Unit No.1 Riyadh 13413 3718, Saudi Arabia",Shopping mall,Riyadh,SA,False,True,Ahmed Jareer Bajwa,2 months ago,2024-07-08T15:30:20.293Z,5.0,"It was one of the most lavish, peaceful, and relaxing places i visited in Riyadh.  Kids will enjoy their freedom. You can also buy and eat your favorite food afterward.",4.5,en,5 stars
"3718, 8793 - King Khalid International Airport - Unit No.1 Riyadh 13413 3718, Saudi Arabia",Shopping mall,Riyadh,SA,False,True,Kaptain Guzzy,5 months ago,2024-05-02T22:12:24.235Z,4.0,"Nice, pretty at night. Lots of shops and eateries including an Indian 'Street Food' place that also does the likes of chaat,  butter chicken, lamb biryani and lamb chops! Visit if in the area or going to an exhibition at the nearby exhibition centre. Easy to get taxis.",4.5,en,4 stars
"3718, 8793 - King Khalid International Airport - Unit No.1 Riyadh 13413 3718, Saudi Arabia",Shopping mall,Riyadh,SA,False,True,Ibrahim Lahoud,4 months ago,2024-05-21T05:51:49.636Z,5.0,"A delightful surprise in Riyadh. Beautiful architecture, amazing features, wide choice of outlets, and an ingenious way of walking around either indoor or outdoor. Love it.",4.5,en,5 stars
"3718, 8793 - King Khalid International Airport - Unit No.1 Riyadh 13413 3718, Saudi Arabia",Shopping mall,Riyadh,SA,False,True,Bing Marcos,5 months ago,2024-04-19T19:53:24.031Z,5.0,"A great place to visit with your family and friends. They have a variety of restaurants, cafe’s and shops. The ambiance is different from your typical generic shopping malls.",4.5,en,5 stars
"3718, 8793 - King Khalid International Airport - Unit No.1 Riyadh 13413 3718, Saudi Arabia",Shopping mall,Riyadh,SA,False,True,Mahmoud Khammash,6 months ago,,5.0,"""Roshn Front Riyadh: A Premier Destination for Shopping and Leisure""

Situated in the heart of Riyadh, Roshn Front emerges as a dynamic and sophisticated shopping area that redefines the concept of retail therapy. Spanning across a sprawling landscape, Roshn Front offers an unparalleled blend of luxury boutiques, diverse dining options, and vibrant entertainment experiences, making it a premier destination for locals and tourists alike.

As you enter Roshn Front, you are greeted by a modern and inviting ambiance that sets the stage for a memorable shopping excursion. The sleek architecture, adorned with stylish design elements and lush greenery, creates an atmosphere of elegance and sophistication, inviting visitors to explore and indulge in a world of luxury and leisure.

From international fashion brands to local artisans, Roshn Front boasts an impressive array of retail outlets that cater to every style and taste. Whether you're searching for the latest trends in fashion and accessories or seeking unique gifts and souvenirs, Roshn Front offers something for everyone, ensuring a truly rewarding shopping experience.

But Roshn Front is more than just a shopping destination; it's a vibrant hub of entertainment and cultural experiences. The outdoor promenades and public spaces provide the perfect setting for leisurely strolls and social gatherings, while the numerous cafes and restaurants offer a diverse selection of culinary delights to satisfy every craving.

In addition to its retail and dining offerings, Roshn Front also features a range of entertainment options to suit all ages and interests. From family-friendly attractions like playgrounds and interactive exhibits to cultural events and live performances, there's always something exciting happening at Roshn Front, making it the perfect destination for a day of fun and relaxation.

What truly sets Roshn Front apart is its commitment to creating a welcoming and inclusive environment for all visitors. Whether you're a seasoned shopper or a first-time visitor, the friendly staff members and convenient amenities ensure that your experience at Roshn Front is nothing short of exceptional.

In a city as dynamic and diverse as Riyadh, Roshn Front stands out as a true gem, offering a world-class shopping and leisure experience that is second to none. Whether you're looking to indulge in retail therapy, savor gourmet cuisine, or simply soak in the vibrant atmosphere, Roshn Front invites you to discover the best that Riyadh has to offer and create memories that will last a lifetime.",4.5,en,Error
"3718, 8793 - King Khalid International Airport - Unit No.1 Riyadh 13413 3718, Saudi Arabia",Shopping mall,Riyadh,SA,False,True,Lluis Viñas,2 weeks ago,2024-09-15T17:11:41.358Z,5.0,"Nice Mall near the airport, located in the Northern parts of Riyadh. Quite a variety of restaurants (steakhouse, italian, lebanese, japanese…), as well as a cinema which has opened quite recently.",4.5,en,4 stars
"3718, 8793 - King Khalid International Airport - Unit No.1 Riyadh 13413 3718, Saudi Arabia",Shopping mall,Riyadh,SA,False,True,Peter Wright,4 months ago,2024-05-15T04:18:29.910Z,5.0,"Lots available here, good selection of shops, and more options for restaurants for those seeking more than coffee and cake",4.5,en,4 stars
"3718, 8793 - King Khalid International Airport - Unit No.1 Riyadh 13413 3718, Saudi Arabia",Shopping mall,Riyadh,SA,False,True,Muhammad Ali Javed,a year ago,2023-04-25T21:19:27.841Z,4.0,"One of the beautifully modern constructed areas in Riyadh. It has shops for clothes, shoes, makeup, perfume and other accessories as well as stalls. Lot of restaurants and cafes available with indoor and outdoor dining. Also, cinema is there. It is usually crowded on weekends and public holidays. Spacious parking available but difficult to find parking quickly in rush hours.",4.5,en,5 stars
"3718, 8793 - King Khalid International Airport - Unit No.1 Riyadh 13413 3718, Saudi Arabia",Shopping mall,Riyadh,SA,False,True,Ar Em,a month ago,2024-08-28T17:20:33.030Z,5.0,A nice trendy shopping and dining area.  Recommend a visit.,4.5,en,4 stars
"3718, 8793 - King Khalid International Airport - Unit No.1 Riyadh 13413 3718, Saudi Arabia",Shopping mall,Riyadh,SA,False,True,Shafia Jamal,4 months ago,2024-05-15T21:56:04.402Z,5.0,"Going to Roshn front is always a treat. Love the restaurants and the shops.
A very good place to detox yourself at the end of the day. ♥️",4.5,en,5 stars
"3718, 8793 - King Khalid International Airport - Unit No.1 Riyadh 13413 3718, Saudi Arabia",Shopping mall,Riyadh,SA,False,True,Amany Ghozlan,a year ago,2022-12-22T08:04:05.444Z,4.0,"It’s an open-air shopping area, perfect for those who would like to do their walking activity of the day, without even feeling that the paid an effort. It’s entertaining to walk while window shopping and at the same time enjoy nature (water fountains, green areas, sky above you, a sunny day if you’re lucky). I really enjoyed being there.
It’s not as big as UWALK of course, but it has more shopping options. The Riyadh Front has many cafes and restaurants, but for our bad luck, we picked one that had an annoying service team (Balcony). It had a wonderful seating area beside one of the fountains,  it the staff members were not welcoming at all.
So many shops are still empty, so I believe that in the very near future it will easily deserve a 5 star rating from anyone who goes there.",4.5,en,4 stars
"3718, 8793 - King Khalid International Airport - Unit No.1 Riyadh 13413 3718, Saudi Arabia",Shopping mall,Riyadh,SA,False,True,Dr Omer Aziz,2 years ago,2022-05-04T21:47:50.161Z,5.0,A very good indoor and outdoor place. Loved the ambience. The thing that I liked most was the open air food area. The dancing fountain was also great. I wish it had some music / rhythm synchronisation for making it even better. Has almost everything for an international community.,4.5,en,4 stars
"3718, 8793 - King Khalid International Airport - Unit No.1 Riyadh 13413 3718, Saudi Arabia",Shopping mall,Riyadh,SA,False,True,كن متميزاً,a year ago,2023-02-09T11:39:40.788Z,5.0,"(modern outdoor mall) many shops, restaurants, fountains, and green spaces. It was a wonderful experience after the LEAP conference. A quiet and beautiful place to enjoy modern architecture.",4.5,en,5 stars
"3718, 8793 - King Khalid International Airport - Unit No.1 Riyadh 13413 3718, Saudi Arabia",Shopping mall,Riyadh,SA,False,True,Maged Sahyoun,a year ago,2023-04-24T12:22:36.023Z,5.0,"The place is very calm clean and well maintained and organized with a variety of casual and fine dining restaurants and coffee shops a great place to enjoy a dining experience with friends and family suitable for kids also they have big open spaces
Especially around the gig lake and fountains kids will enjoy
Walking between the big screens will gives you a feeling like walking in new york
The only thing is uncomfortable is the parking that is not well organised especially the entrance and exit",4.5,en,4 stars
"3718, 8793 - King Khalid International Airport - Unit No.1 Riyadh 13413 3718, Saudi Arabia",Shopping mall,Riyadh,SA,False,True,Jhing2803,2 years ago,2022-07-12T10:21:12.085Z,5.0,"My first time here. But been wanting to come since before. Nice place. A lot of stores and a lot of steak restaurants  not crowded at noon. But at night, a lot of people. Children are playing, families are eating, and just people are hanging out.",4.5,en,4 stars
"3718, 8793 - King Khalid International Airport - Unit No.1 Riyadh 13413 3718, Saudi Arabia",Shopping mall,Riyadh,SA,False,True,Kushagra Singh,3 years ago,2021-01-21T10:59:37.518Z,5.0,"One of the best and most unique places not just in Riyadh but whole of Saudi.
The place is a mix of indoor & outdoor space. The outdoor area is the main attraction and has a lot of pools & fountains making the place look very beautiful especially in the night with all the decorative lighting.
The place has a huge variety of cafes and restaurants some of which are in the middle of these pools. It's a very good place to enjoy the natural weather especially during the winters (although sometimes it might get a little cold). It has a good selection of stores and a huge VOX cinema. It also has a museum.
Finding a parking sometimes can some time but the place is all worth it.",4.5,en,5 stars
"7295 King Faisal Rd، 3205, Riyadh 13711, Saudi Arabia",Tourist attraction,Riyadh,SA,False,True,Chua Hsieh Li,2 weeks ago,2024-09-13T20:58:11.032Z,3.0,"50 sar entrance fee to see the fort and the terrace with shops, it’s not too bad because the 50 sar is registered as credits which can be redeemed in the restaurants.

Would give a 5 star for the venue except the entrance service staff was rude and unhelpful and the process to buy the ticket is online only, with no WiFi provided",4.6,en,3 stars
"7295 King Faisal Rd، 3205, Riyadh 13711, Saudi Arabia",Tourist attraction,Riyadh,SA,False,True,Jisha Kaniyankandi,5 months ago,2024-04-27T07:07:01.981Z,5.0,"Bujari Terrace offers breathtaking scenic views! The ambiance enhances the dining experience, making it a memorable place to enjoy good food with a stunning backdrop.",4.6,en,5 stars
"7295 King Faisal Rd، 3205, Riyadh 13711, Saudi Arabia",Tourist attraction,Riyadh,SA,False,True,Zeeshan Naeem,5 months ago,2024-05-03T05:56:55.441Z,5.0,"The history of Dirriya and KSA is well versed here. It's a beautiful place and a must visit in Riyadh
50 Riyals entry per person (this can be used inside)",4.6,en,5 stars
"7295 King Faisal Rd، 3205, Riyadh 13711, Saudi Arabia",Tourist attraction,Riyadh,SA,False,False,Roudaina Mahmoud,5 months ago,2024-04-17T16:57:08.033Z,2.0,"This place is too much expensive,one bottle of water 20 riyal!!!!
But the most important thing is that this place doesn't fit for kids. They can't run jump play, and they can't have a scooter or a ball nothing at all. What is possible they can walk and quietly.nothing for kids at all ohhhh yes there was one merry-go-round was too slow  but yeyyyy for free. Hih. Briefly it is a nice place very well designed to look like vintage with very good variety of restaurants but it is for singles or colleges or businesses but not for families with kids or toddlers full of life and energy.",4.6,en,2 stars
"7295 King Faisal Rd، 3205, Riyadh 13711, Saudi Arabia",Tourist attraction,Riyadh,SA,False,True,Fazeel Anwar,5 months ago,2024-04-20T12:36:16.216Z,5.0,"A wonderful place to visit to recall history of the house of the Saud and real leftovers from that era, the hard work of maintaining this place is really appreciable, loved the way how everything is explained by the staff and projectors with the help of sounds of wars. Totally worth a visit.",4.6,en,5 stars
