address,categories/0,city,countryCode,isAdvertisement,isLocalGuide,name,publishAt,publishedAtDate,stars,text,totalScore,language,sentiment
"الهدا،، 2941 طريق مكة المكرمة، 8425، حي الهدا، الرياض 12912،،, Riyadh 12912،, Saudi Arabia",Shopping mall,Riyadh,SA,False,True,Shoaib Mohammed,a year ago,2023-09-23T00:22:43.995Z,2.0,"The place is very impressive and different from other newly opened places. Parking costs SAR 50 for the first hour and SAR 10 for each extra hour. I believe that parking is their only source of income. I dont think anyone will purchase or eat there because they are very pricey

The best time to visit this place is night time. They have lit the place with colorful lights and candles. Also, from here, you can have a stunning view of the Ritz-Carlton.

The worst thing about this place is that you can not park your car outside and enter the place. The security guards will not allow you inside the place if you are coming by foot or taxi.",4.5,en,4 stars
"الهدا،، 2941 طريق مكة المكرمة، 8425، حي الهدا، الرياض 12912،،, Riyadh 12912،, Saudi Arabia",Shopping mall,Riyadh,SA,False,True,was sib,3 months ago,2024-06-18T17:42:36.477Z,5.0,"Great place to visit , parking cost SR 50 FOR THE FIRST 1 HOUR",4.5,en,5 stars
"الهدا،، 2941 طريق مكة المكرمة، 8425، حي الهدا، الرياض 12912،،, Riyadh 12912،, Saudi Arabia",Shopping mall,Riyadh,SA,False,True,Waleed,a year ago,2023-07-22T23:36:03.243Z,5.0,"VIA Riyadh is an exceptional top notch location that reminds me of VIA Rodeo at Beverly Hills, Los Angeles.

The stores in the mall are for the finest brands and designers worldwide. Therefore, it is targeting customers looking for such luxurious experience.

Entrance was for free when I visited, but the parking cost was 50 SAR. If you have a movie reservation or a restaurant reservation the parking fee would be waived.

I enjoyed the walk during the sunset.",4.5,en,5 stars
"الهدا،، 2941 طريق مكة المكرمة، 8425، حي الهدا، الرياض 12912،،, Riyadh 12912،, Saudi Arabia",Shopping mall,Riyadh,SA,False,True,Trinakatz Gonzales,10 months ago,2023-11-04T06:58:08.915Z,4.0,"An upscale F&B  and shopping place in Riyadh. The place wasn’t too crowded when we visited. Can wander around comfortably. If you want to dine-in in a high-end restaurant, you can easily walk-in without a reservation (from our experience, maybe because it’s still newly-opened). This place is home to world renowned restos/bistros, we’ve seen YakinikuMafia [they opened at 7pm and we were starving by 6pm, we ended up at Scott’s (review to follow) for seafood], Gymkhana for indian cuisine, Wolfgang Puck’s Spago, Raoul’s, Sexy Fish (coming soon at the time of writing) and more! They also have a luxury food market (VIA Mercato), YokuMoku. I think VIA seems like the Mayfair of Riyadh. The ambience is resplendent! Very relaxing landscape, a much welcoming outdoor oasis, this development is thoughfully built and carefully curated to speak luxury & modernity. Be prepared to pay more for the parking though if you want to stay longer. We paid 70SAR for spending 2 hrs and 24mins.",4.5,en,4 stars
"الهدا،، 2941 طريق مكة المكرمة، 8425، حي الهدا، الرياض 12912،،, Riyadh 12912،, Saudi Arabia",Shopping mall,Riyadh,SA,False,True,Abu EliZak,2 weeks ago,2024-09-17T12:09:33.234Z,2.0,Disappointed by overpriced atmosphere of mall which lacked seating for relaxing unless spending money at restaurants. Parking was 70 SAR for 2 hours. Will not return. Restaurants overpriced for the service and quality provided. Better options elsewhere in Riyadh.,4.5,en,2 stars
"الهدا،، 2941 طريق مكة المكرمة، 8425، حي الهدا، الرياض 12912،،, Riyadh 12912،, Saudi Arabia",Shopping mall,Riyadh,SA,False,True,Guli,9 months ago,2023-12-25T13:01:39.092Z,5.0,"Amazing luxurious and cozy , a lot of restaurants, you need to book before you plan to go , make sure to check the timings of opening and closing , a lot of shops and cafe .",4.5,en,5 stars
"الهدا،، 2941 طريق مكة المكرمة، 8425، حي الهدا، الرياض 12912،،, Riyadh 12912،, Saudi Arabia",Shopping mall,Riyadh,SA,False,True,Bareed Bareedg,9 months ago,2023-12-21T07:29:11.016Z,4.0,Tooo expansive. Parking cost $$$.  But it’s nice at night for a coffee and walking around. Worth visiting once in your life.,4.5,en,4 stars
"الهدا،، 2941 طريق مكة المكرمة، 8425، حي الهدا، الرياض 12912،،, Riyadh 12912،, Saudi Arabia",Shopping mall,Riyadh,SA,False,True,abdulaziz Abahusain,a year ago,2023-06-02T08:05:24.936Z,5.0,"Luxurious area, for international fine dining restaurants, high brands, upscale cinema “FOX” and 5 star hotel “The St. Regis”
You don’t need an entry ticket, but you might need a cafe or restaurant or cinema reservation.

I tried the cinema very upscale and it was a great experience, the parking fee is 50 SAR for the first hour, and after that every additional hour is 10 SAR, but because I have a cinema ticket they canceled the fee ""you must have the parking paper with you"".",4.5,en,4 stars
"الهدا،، 2941 طريق مكة المكرمة، 8425، حي الهدا، الرياض 12912،،, Riyadh 12912،, Saudi Arabia",Shopping mall,Riyadh,SA,False,True,A KHAN,3 months ago,2024-06-22T13:54:17.075Z,4.0,PARKING IS SR50 for first hour!! BEWARE. NO FREE PARKING!!,4.5,en,1 star
"الهدا،، 2941 طريق مكة المكرمة، 8425، حي الهدا، الرياض 12912،،, Riyadh 12912،, Saudi Arabia",Shopping mall,Riyadh,SA,False,True,Dina -,a year ago,2023-05-31T18:18:24.012Z,5.0,"VIA Riyadh was a really wonderful place and all the decor and lights were nice for the eyes to look at, it’s a place you can visit with your friends and family, always looks nice whether you visit at day or night. For parking : first hour will be 50 SAR, then each hour 10 SAR. I highly recommend visiting this wonderful place, as I had a lot of fun there.",4.5,en,5 stars
"الهدا،، 2941 طريق مكة المكرمة، 8425، حي الهدا، الرياض 12912،،, Riyadh 12912،, Saudi Arabia",Shopping mall,Riyadh,SA,False,True,Zeeshan Farid,a year ago,2023-05-19T22:28:20.533Z,5.0,"Very luxuriuos place to visit , you will not feel like you are in Saudia. It is very incredible and sensational - Jim dandy !! Nice place to hangout !!

Parking charges are 50 SAR per hour.
Nice ambience and culture -!! Vision 2030",4.5,en,5 stars
"الهدا،، 2941 طريق مكة المكرمة، 8425، حي الهدا، الرياض 12912،،, Riyadh 12912،, Saudi Arabia",Shopping mall,Riyadh,SA,False,True,Najla Alm,9 months ago,2023-12-12T11:25:26.971Z,5.0,"Lovely chilling place
With excellent vibe
If you don’t have a restaurant reservation you’ll pay 50 SAR for the parking with extra 10 SAR for one hour",4.5,en,5 stars
"الهدا،، 2941 طريق مكة المكرمة، 8425، حي الهدا، الرياض 12912،،, Riyadh 12912،, Saudi Arabia",Shopping mall,Riyadh,SA,False,True,Reem BK,a year ago,2023-05-21T03:46:59.745Z,5.0,"Nice atmosphere at night , many stores are opened there. I visited market , it was a very nice cheese taste experience in cheese section.
There is vallet.
Before you go you need to make reservation .",4.5,en,4 stars
"الهدا،، 2941 طريق مكة المكرمة، 8425، حي الهدا، الرياض 12912،،, Riyadh 12912،, Saudi Arabia",Shopping mall,Riyadh,SA,False,False,Sama AR,2 months ago,2024-07-11T13:46:37.361Z,5.0,Amazing place  I did play music there and I had so much fun  thank u VIA RIYADH,4.5,en,5 stars
"الهدا،، 2941 طريق مكة المكرمة، 8425، حي الهدا، الرياض 12912،،, Riyadh 12912،, Saudi Arabia",Shopping mall,Riyadh,SA,False,True,Qutaiba AlSendi,8 months ago,2024-01-20T12:41:20.844Z,5.0,"- luxury place with many cafes
- love the atmosphere specially in winter season
- easy to find parking",4.5,en,5 stars
"الهدا،، 2941 طريق مكة المكرمة، 8425، حي الهدا، الرياض 12912،،, Riyadh 12912،, Saudi Arabia",Shopping mall,Riyadh,SA,False,True,Zeina EL Alami,7 months ago,2024-02-10T20:12:04.654Z,5.0,"An elegant atmosphere for shopping and restaurants, now you do not need to reserve online just walk-in",4.5,en,5 stars
"الهدا،، 2941 طريق مكة المكرمة، 8425، حي الهدا، الرياض 12912،،, Riyadh 12912،, Saudi Arabia",Shopping mall,Riyadh,SA,False,True,Stephanie Doumit,6 days ago,2024-09-27T08:59:27.964Z,3.0,"Aesthetically pleasing place but nothing more
Not too many options aligning with everyone’s needs and ability, targeting a certain category of people or else you can do nothing there except walking
The options are not easily accessible like you need to know where you are going and what you are visiting so you can go there or else you will not find it out of nowhere while you are walking there
Overall the place is beautiful and nicely designed",4.5,en,3 stars
"الهدا،، 2941 طريق مكة المكرمة، 8425، حي الهدا، الرياض 12912،،, Riyadh 12912،, Saudi Arabia",Shopping mall,Riyadh,SA,False,True,MAATH ABDULLA,9 months ago,2023-12-25T22:20:13.409Z,3.0,"A beautiful place, but there are not many options. There are only three but four restaurants. The prices are exaggerated, the options are limited and there are not many cafes. Expectations are that it will be better than that.",4.5,en,3 stars
"الهدا،، 2941 طريق مكة المكرمة، 8425، حي الهدا، الرياض 12912،،, Riyadh 12912،, Saudi Arabia",Shopping mall,Riyadh,SA,False,True,Anju Patwardhan,10 months ago,2023-11-30T17:08:12.927Z,5.0,Stunning building with some very high end shops and restaurants. Beautiful terrace and lots of outdoor seating which is lovely in this weather.,4.5,en,5 stars
"الهدا،، 2941 طريق مكة المكرمة، 8425، حي الهدا، الرياض 12912،،, Riyadh 12912،, Saudi Arabia",Shopping mall,Riyadh,SA,False,True,Reem,a year ago,2023-08-15T08:57:39.496Z,5.0,A grand new place in the city. I think it will be full of fabulous resturants and cafe’s. There will be many hotels too and a new stylish cenima. Note : the parking is 50sr for the hour.,4.5,en,5 stars
"الهدا،، 2941 طريق مكة المكرمة، 8425، حي الهدا، الرياض 12912،،, Riyadh 12912،, Saudi Arabia",Shopping mall,Riyadh,SA,False,False,Bakhtawar Qazi,a week ago,2024-09-24T05:19:55.348Z,4.0,"The place is good with free entry, but make sure parking charges are 60 sar.
This is the place for elite with so many international brands",4.5,en,3 stars
"الهدا،، 2941 طريق مكة المكرمة، 8425، حي الهدا، الرياض 12912،،, Riyadh 12912،, Saudi Arabia",Shopping mall,Riyadh,SA,False,True,Mohammad,8 months ago,2024-02-01T15:54:23.212Z,5.0,"If you love visiting upscale places and spending a wonderful time, you must visit this picturesque place. You will find a number of distinctive restaurants and cafes where you will enjoy having a meal or a cup of coffee. Photography lovers will find many wonderful angles to take beautiful pictures.",4.5,en,5 stars
"الهدا،، 2941 طريق مكة المكرمة، 8425، حي الهدا، الرياض 12912،،, Riyadh 12912،, Saudi Arabia",Shopping mall,Riyadh,SA,False,True,Zannat Neera,a year ago,2023-08-24T02:57:39.180Z,5.0,Love this place. It's very beautiful & very professional staff. Perfect place to do photoshoot with your mobile phone (I'm not sure about dslr camera).Would love to visit again & again. Thank you,4.5,en,5 stars
"الهدا،، 2941 طريق مكة المكرمة، 8425، حي الهدا، الرياض 12912،،, Riyadh 12912،, Saudi Arabia",Shopping mall,Riyadh,SA,False,True,Gary Dugan,11 months ago,2023-10-30T13:09:15.835Z,5.0,Amazing new mall with great dining options. Really leasing on the eye in the evening. Shopping is high fashion,4.5,en,5 stars
"الهدا،، 2941 طريق مكة المكرمة، 8425، حي الهدا، الرياض 12912،،, Riyadh 12912،, Saudi Arabia",Shopping mall,Riyadh,SA,False,True,Luxury World,9 months ago,2023-12-21T19:49:52.473Z,5.0,So proud to be Saudi Via Riyadh one of the amazing places having a lot of restaurants and coffee shops I recommend you to visit and enjoy this beautiful place…..,4.5,en,5 stars
"الهدا،، 2941 طريق مكة المكرمة، 8425، حي الهدا، الرياض 12912،،, Riyadh 12912،, Saudi Arabia",Shopping mall,Riyadh,SA,False,True,ayyoob chekkindakath,3 months ago,2024-06-19T19:45:28.997Z,4.0,Very nice place dining and shopping,4.5,en,5 stars
"الهدا،، 2941 طريق مكة المكرمة، 8425، حي الهدا، الرياض 12912،،, Riyadh 12912،, Saudi Arabia",Shopping mall,Riyadh,SA,False,True,Tony A,a year ago,2023-07-22T06:50:49.143Z,5.0,"Very nice and classy place to spend your time after work
High end mall with restaurant and coffeeshop and luxury stores .",4.5,en,5 stars
"الهدا،، 2941 طريق مكة المكرمة، 8425، حي الهدا، الرياض 12912،،, Riyadh 12912،, Saudi Arabia",Shopping mall,Riyadh,SA,False,True,Energy,8 months ago,2024-01-12T17:56:46.228Z,5.0,Lovely place with wonderful cafes and restaurants. You have to consider that he price is high but deserve to try.,4.5,en,4 stars
"الهدا،، 2941 طريق مكة المكرمة، 8425، حي الهدا، الرياض 12912،،, Riyadh 12912،, Saudi Arabia",Shopping mall,Riyadh,SA,False,False,Abdulaziz Al Qurashi,a week ago,2024-09-19T14:01:57.595Z,5.0,"Place of dreams.

Never getting bored from visiting VIA Riyadh.",4.5,en,5 stars
"الهدا،، 2941 طريق مكة المكرمة، 8425، حي الهدا، الرياض 12912،،, Riyadh 12912،, Saudi Arabia",Shopping mall,Riyadh,SA,False,True,Mehraj Sheikh,9 months ago,2023-12-12T22:33:23.404Z,4.0,"Entrance is always crowded and congested with cars without any alternative ways of parking
Parking charges are higher than expected.
Seems this place is still at isolation.
Otherwise peaceful spot with hifi zone.",4.5,en,3 stars
"الهدا،، 2941 طريق مكة المكرمة، 8425، حي الهدا، الرياض 12912،،, Riyadh 12912،, Saudi Arabia",Shopping mall,Riyadh,SA,False,True,Ahmed Bin Emad,a year ago,2023-07-24T09:16:16.558Z,5.0,The most luxurious newest building in Riyadh I do loved the cafe shops the prices were fine . You should pay 50 sar for one hour car parking then 10 year  but some restaurants and the VOX cinema can gives you a par-code that’s you don’t have to pay for your parking car !  which is fine,4.5,en,5 stars
"الهدا،، 2941 طريق مكة المكرمة، 8425، حي الهدا، الرياض 12912،،, Riyadh 12912،, Saudi Arabia",Shopping mall,Riyadh,SA,False,True,Tech Help Bangla,11 months ago,2023-10-26T09:55:49.607Z,5.0,It’s an amazing shipping mall with different views. If you are in Riyadh don’t miss to visit this place. Awesome outdoor decor with awesome lighting,4.5,en,5 stars
"الهدا،، 2941 طريق مكة المكرمة، 8425، حي الهدا، الرياض 12912،،, Riyadh 12912،, Saudi Arabia",Shopping mall,Riyadh,SA,False,True,Mai Abdo,a year ago,2023-09-18T12:31:18.312Z,5.0,"An impressive place , make sure to go at night to enjoy the colorful lights .

Many places and choices there to enjoy.

No matter what you are craving you will find it.

If you are looking for luxury and an experience to remember just go there and enjoy the variety of restaurants.",4.5,en,5 stars
"الهدا،، 2941 طريق مكة المكرمة، 8425، حي الهدا، الرياض 12912،،, Riyadh 12912،, Saudi Arabia",Shopping mall,Riyadh,SA,False,True,WorldHow? Unseen,6 months ago,2024-03-20T02:27:38.882Z,5.0,"VIA Riyadh stands as a pinnacle of luxury in the heart of Riyadh, offering a comprehensive shopping experience like no other. This opulent mall boasts an array of exquisite features, including top-notch 5-star restaurants, the prestigious St. Regis hotel, high-end boutiques , luxury food market Mercato , restaurants Spago Ferdi Medio, delightful Cafe Elle, world-class entertainment at Vox Cinema, Orlin Ski, and much more. It's all here, meticulously curated to provide you with the epitome of luxury. Come and immerse yourself in the lavish ambiance of VIA Riyadh, where every visit promises a truly indulgent experience.",4.5,en,5 stars
"2662، الحوي، 7199،, Riyadh 13516،, Saudi Arabia",Theme park,Riyadh,SA,False,True,Ahmed Mishal,a week ago,2024-09-25T18:53:27.108Z,4.0,"The Boulevard World in Riyadh is a highlight of the Riyadh Season, offering a global cultural experience without leaving the city. Visitors can explore themed zones representing different countries such as Mexico, France, Italy, and Greece, and enjoy immersive activities, culinary delights, and cultural exhibits. Highlights include gondola rides in Venice, iconic landmarks like the Eiffel Tower, and theme park attractions, including the world's largest artificial lake. Families can also engage in fun activities like escape rooms, interactive shows, and thrilling rides.",4.6,en,4 stars
"2662، الحوي، 7199،, Riyadh 13516،, Saudi Arabia",Theme park,Riyadh,SA,False,True,M-S Shaikh,a month ago,2024-08-22T21:35:23.423Z,5.0,"Boulevard World in Riyadh is an incredibly beautiful place, showcasing architectural wonders from around the globe. It's the perfect spot to enjoy with family, friends, or as a couple. From delicious food to leisurely strolls, there's something for everyone. The large artificial lake adds to the stunning scenery, making it one of the best places to visit. I had a wonderful experience when I visited in January 2024.",4.6,en,5 stars
"2662، الحوي، 7199،, Riyadh 13516،, Saudi Arabia",Theme park,Riyadh,SA,False,True,Krrish !,3 months ago,2024-06-08T10:47:03.538Z,5.0,"I recently had the pleasure of visiting Boulevard World in Riyadh, and it was an experience like no other! This vibrant entertainment district is a perfect blend of culture, fun, and excitement, offering something for everyone.

The layout of Boulevard World is impressive, with beautifully designed spaces and themed areas that transport you to different parts of the world. The variety of attractions is astounding—from thrilling amusement rides to interactive exhibits and live performances, there’s never a dull moment. The attention to detail in every corner truly makes it feel like a world tour in one location.

One of the highlights of my visit was the diverse range of dining options available. From gourmet restaurants to casual eateries, the culinary offerings are as varied and delicious as the attractions themselves. The street food vendors added an authentic touch, allowing us to sample flavors from around the globe.

What truly made our visit exceptional was the lively atmosphere and the friendly staff. Everyone was welcoming and eager to help, enhancing the overall experience. The cleanliness and organization of the entire area were also commendable, making it a pleasant place to spend the day with family and friends.

Boulevard World is a must-visit destination in Riyadh. Whether you’re looking for adventure, relaxation, or a cultural journey, this entertainment hub has it all. I can’t wait to go back and explore more of what it has to offer!",4.6,en,5 stars
"2662، الحوي، 7199،, Riyadh 13516،, Saudi Arabia",Theme park,Riyadh,SA,False,True,Pam Ami,5 months ago,2024-04-27T11:54:30.518Z,5.0,"Nice place to enjoy with family. It has amazing rides which can be enjoyed by every age group. Fantastic way to spend the afternoon and evening. The whole place is themed and filled with shops, styles, and food from all over the world.

I would like to emphasize the floating eatery with boat-shaped stalls in it. I think they are really cool, the ambience is great, the food and beverages are exemplary.

When it comes to safety, the world is well equipped with helping staffs.

Highly recommended indeed!",4.6,en,5 stars
"2662، الحوي، 7199،, Riyadh 13516،, Saudi Arabia",Theme park,Riyadh,SA,False,True,Sidra Ahmed,4 months ago,2024-05-31T06:59:35.624Z,5.0,"*Boulevard World: An Unforgettable Experience*

Boulevard World was an incredible experience. The utilization of the space and the accuracy in replicating various countries and their markets were impressive. There’s so much to explore, enjoy, and learn at the same time. The overbridge with a flowing river beneath gives off peaceful vibes.

**Countries Featured:**
Italy, Greece, France, Turkey, USA, UK, Rome, Egypt, Spain, Thailand, India, China, and more.

*Pro Tip: For great pictures, visit Greece and Italy in the afternoon when the sun is still out.*

**Things to See:**
- **Morocco Market:** Great for shopping.
- **Floating Market:** Beautifully decorated with umbrellas as the roof, perfect for pictures.
- **India:** Enjoy captivating performances.

**Fun Activities:**
- The games area is located between Egypt and the UK, offering numerous fun and exciting rides.
- Boat rides of various types are available, including small boats, car-boat rides, and larger boats accommodating 14+ people.
- Near Greece, there is a combat area for activities like shooting and archery.

This is definitely a MUST-VISIT place. I recommend arriving at the opening hour to have ample time to explore and enjoy everything.",4.6,en,4 stars
"2662، الحوي، 7199،, Riyadh 13516،, Saudi Arabia",Theme park,Riyadh,SA,False,True,Dr Nikhita Praveen,5 months ago,2024-04-20T11:35:25.717Z,5.0,"What an incredible place 
.
.
.
Boulevard World
.
.
Very beautiful place with different cultures from around the world  It’s a must visit destination in Riyadh.
.
The best time to visit is in the evening around 5pm , so that you can see these beautiful places in day light and later in the night also.

You will get beautiful pictures and amazing experience.",4.6,en,5 stars
"2662، الحوي، 7199،, Riyadh 13516،, Saudi Arabia",Theme park,Riyadh,SA,False,True,Zaid Al-Asa'd,2 weeks ago,2024-09-14T01:22:33.831Z,5.0,"Riyadh Boulevard World is an absolutely stunning destination! I was truly impressed by the vibrant atmosphere, diverse entertainment options, and the breathtaking views. The unique blend of cultural zones, world-class attractions, and immersive experiences made every moment exciting. From the exceptional food courts to the spectacular light displays, every detail was thoughtfully crafted. It’s a must-visit spot for anyone looking to enjoy an unforgettable experience in Riyadh. Highly recommend!",4.6,en,5 stars
"2662، الحوي، 7199،, Riyadh 13516،, Saudi Arabia",Theme park,Riyadh,SA,False,True,Salman Farizi Salu,4 months ago,2024-05-04T03:52:26.455Z,5.0,"Wow! You're going to have the time of your life! Once you bring your family to these parks, they'll be blown away by the incredible lights, fantastic atmosphere, and endless activities for everyone to enjoy. Get ready for an adventure like no other and memories you'll cherish forever!✨",4.6,en,5 stars
"2662، الحوي، 7199،, Riyadh 13516،, Saudi Arabia",Theme park,Riyadh,SA,False,True,Arif Khan,5 months ago,2024-04-21T20:44:45.248Z,5.0,"Visited on a Saturday , hence there wasn’t much crowd. The place is amazing and very well setup. All the countries pavilions are unique with their unique architecture and restaurants and cafes with specialized cuisines. They do have performances and shows that happen in each pavilion. All in all a great experience. The entry is reasonable , however the food is a little on the higher side",4.6,en,4 stars
"2662، الحوي، 7199،, Riyadh 13516،, Saudi Arabia",Theme park,Riyadh,SA,False,True,Alkis,4 months ago,2024-05-05T08:00:16.486Z,3.0,"Do not pay more than the simplest ticket. It is totally not worth it. You need to wait about an hour for each ride. Queues are moving very slow. In general it is a nice concept but at the end of the day it is a replica. Restaurants are “fast food” oriented. Sit down order pay and go…
One time visit is ok.",4.6,en,1 star
"2662، الحوي، 7199،, Riyadh 13516،, Saudi Arabia",Theme park,Riyadh,SA,False,True,Aymeric S,5 months ago,2024-04-28T13:42:01.929Z,5.0,"I was looking for an evening activity and I was not disappointed. The people at the entrance were very helpful to get the ticket (through the app Webook) and the price of 109 SAR IS very reasonable for the entrance + 10 rides included.
The place was quite busy which was great, walking through all the areas. Quality of the place is very well done and the games/activities are enjoyable. I recommend to take the cable car to have a nice view on the park and also Boulevard City.
I had a blast !",4.6,en,4 stars
"2662، الحوي، 7199،, Riyadh 13516،, Saudi Arabia",Theme park,Riyadh,SA,False,True,yani2610,3 months ago,2024-06-12T14:20:43.922Z,5.0,"The development of Boulevard World has been remarkable, resulting in a wonderland of scenic beauty in a surprisingly short timeframe. The attached images showcase the stunning vistas that have captivated visitors, offering a delightful experience for families. The captivating light shows by the lake and the availability of exceptional dining establishments, such as Rieti, contribute to the overall enchantment of this destination. Visitors from all corners are certain to find immense enjoyment in this miraculous accomplishment completed in a brief period.",4.6,en,5 stars
