address,categories/0,city,countryCode,isAdvertisement,isLocalGuide,name,publishAt,publishedAtDate,stars,text,totalScore,language,sentiment
"2662، الحوي، 7199،, Riyadh 13516،, Saudi Arabia",Theme park,Riyadh,SA,False,True,Jeanneth Tuloy,7 months ago,2024-03-03T05:32:55.155Z,5.0,"One day is not enough for the boulevard world alone. It was amazingly beautiful, it was a great experience. You must prepare money hahaha. There is a lot to buy and food to try. A lot of staff too to guide you, Come and experience Riyadh season it's worth it.",4.6,en,5 stars
"2662، الحوي، 7199،, Riyadh 13516،, Saudi Arabia",Theme park,Riyadh,SA,False,True,Maadhavan Prasanna,9 months ago,2023-12-29T11:44:07.182Z,5.0,"Beautiful Riyadh Season zone with a mind blowing array of architectural styles, rides, restaurants, and other attractions. Walking around on a pleasant Riyadh afternoon was truly enjoyable as the ambiance as unmatched. Vendors offer different cuisines in each of the twelve zones and its wonderful to see such beautifully represented diversity. I particularly enjoyed the rides because they were well priced and catered to all ages. The Sky Loop roller coaster was truly thrilling as it had good air time and loops. I'd recommend going with the whole family.  However, be sure to book as far ahead because tickets tend to sell out and only the most expensive options are left.",4.6,en,4 stars
"2662، الحوي، 7199،, Riyadh 13516،, Saudi Arabia",Theme park,Riyadh,SA,False,True,shabeeb cv,9 months ago,2024-01-03T08:16:19.276Z,5.0,"Great entertainment, well organised, good hospitality,well maintained and clean. A must visit place in Riyadh . Minimum time required to cover is 2 to 3 hours. You can purchase different cultural items. Staff are supportive

No professional cameras allowed. Crowded in the weekends. Need ticket through webook app.

Parking is little difficult. Paid parking in the front side or free parking on the plot Cross the road of entrance-1.

Opens at 4pm try to get on time so you can cover many areas in day light",4.6,en,5 stars
"2662، الحوي، 7199،, Riyadh 13516،, Saudi Arabia",Theme park,Riyadh,SA,False,True,Allianah Benito,8 months ago,2024-01-27T20:12:12.343Z,5.0,"Bigger and better Boulevard World with additional zones like Egypt and Thailand. The new restaurants by the Lagoon Lake, which earned the Guinness World record for the largest artificial lake is something you don’t want to miss. Thai cuisines are available and everything we ordered from TomYum, shrimps and Pad Thai were delicious in large portions too. Fireworks start at 9:00 PM but it’s best to arrive on opening hours for a full experience before it gets crowded.",4.6,en,5 stars
"2662، الحوي، 7199،, Riyadh 13516،, Saudi Arabia",Theme park,Riyadh,SA,False,True,Oguzhan Kocabas,10 months ago,2023-11-06T15:22:47.960Z,4.0,"It is one of the must-see places in Riyadh. The planning and construction are very successful, and the regions of the countries are very well designed and realistic. An environment has been created where not only the land mark indications and characteristic features of the countries are exhibited. Don't come here just to walk and look around, you can spend your whole day here. Make a plan. It opens at 16:00, you can have a very enjoyable time between 16:00 and 23:00. Concerts, dance shows and many similar events are waiting for you. You can taste different flavors in restaurants and cafes specific to each country's culture. My suggestion to future guests is you can come at 16:00 during the day and take a nice tour, see the surroundings in the daylight and take a tour by cable car, drink coffee, visit all areas after sunset, feel the night atmosphere and have your dinner wherever you want. then find the most enjoyable event and finally watch or participate in it. Take a cup of coffee sit some where for rest and leave. The half-day enjoyable tour costs 300 SAR. Of course, this amount can increase according to your preferences.",4.6,en,5 stars
"2662، الحوي، 7199،, Riyadh 13516،, Saudi Arabia",Theme park,Riyadh,SA,False,True,ahmed alaa,10 months ago,2023-11-29T03:25:09.416Z,4.0,"The experience was wonderful in every country had its own show in ,and its own market selling its own themes.
Countries I liked were:
China: I liked the Chinese American architecture.
India: every 40 minute they had different shows.
Egypt: had a wonderful market with actual egyptian products sold there.
I liked that there is cable car that takes you to blvd city for free.
What I disliked:
I don't recommend eating there.only brand restaurant to eat there.
I tried Italian bakery goods and it looked amazing but tested trouble.
Other than that its good place to go to and have fun there. They have many activities to do there.I recommend booking in the app before going to do it  . If you ask there is some really cheap rides you can buy in the blvd.Good place for family and friends. All said and  done it was a wonderful experience.",4.6,en,4 stars
"2662، الحوي، 7199،, Riyadh 13516،, Saudi Arabia",Theme park,Riyadh,SA,False,True,Mohamad Hachem,5 months ago,2024-04-17T02:38:10.253Z,5.0,This was one of the wildest jaw-dropping experiences ever with my family!! The best Eid vacation ever for us! Riyadh Boulevard was a blast for all of us; we're coming back for sure.,4.6,en,5 stars
"2662، الحوي، 7199،, Riyadh 13516،, Saudi Arabia",Theme park,Riyadh,SA,False,True,Joanna Albalos,8 months ago,2024-01-20T06:03:10.521Z,5.0,"It is one of the best zones in riyadh season. All the iconic tourist spots of different countries are here, in the mini version. It's crowded because we went during the weekend.
I enjoyed the baklava in the Turkish area. A bit expensive, thou.",4.6,en,4 stars
"2662، الحوي، 7199،, Riyadh 13516،, Saudi Arabia",Theme park,Riyadh,SA,False,True,umair rauf,8 months ago,2024-01-30T09:58:17.226Z,5.0,"The Boulevard World Riyadh tour was a blast for all ages, with a special highlight for kids. The boat riding experience was a must-try and added an extra layer of enjoyment. The event showcased a highly organized display of each country's culture, making it a fascinating and educational experience. I highly recommend it for a fun-filled outing.",4.6,en,5 stars
"7039 العليا، 2808،، الغدير،, Riyadh 13311،, Saudi Arabia",Theme park,Riyadh,SA,False,True,S7,2 years ago,2022-01-17T19:48:13.133Z,5.0,"Words aren’t enough to describe the place, if you want your heart to stop you probably should come here 
Games are so nice and fun, you’ll laugh until your tears come out 
Most recommended place for Riyadh season.
Entry ticket is 55 per week days. 110 for weekends.
Games price range 50 - 75 per game.",4.2,en,5 stars
"7039 العليا، 2808،، الغدير،, Riyadh 13311،, Saudi Arabia",Theme park,Riyadh,SA,False,True,Reem,a year ago,2022-11-20T17:18:56.065Z,4.0,This place is huge. I couldn’t cover it all. The prices of the games are lil high so you need a fortune to play few rounds. But still it deserves the visit. There are many coffee shops and resturants in there. Don’t forget to mark your car location when you park.,4.2,en,4 stars
"7039 العليا، 2808،، الغدير،, Riyadh 13311،, Saudi Arabia",Theme park,Riyadh,SA,False,True,Jennifer Guluran,a year ago,2022-11-28T14:48:38.754Z,4.0,"Riyadh Season Winter Wonderland is one of the best changes that ever happened in Saudi Arabia.

People are able now to have fun in a mixed-gender setting. No one will interrogate or confront you because you are with a male friend or companion.

The location is strategically placed and can be easily reached. It's like a few minutes away from the city center.

Winter Wonderland has an entrance fee of 55 SAR per head during weekdays and 110 SAR per head on weekends.

The Parking lot has a fee as well; it’s 10 SAR per hour (OMG, Riyadh is becoming an expensive city).

I hope they make the parking free of charge for their guests because there’s already an entrance fee. Just my two-cents‼️

People, you need to book online first before going there as you need to pay online. There is no cashier for the entrance fee. Also, prepare your Tawakkalna.

The lady guards will check your bag upon entering. One of the lady guards took some of my gum in my bag hahaha

The atmosphere inside is so relaxed, especially during this winter season. Yes, girl, we have winter here in Saudi Arabia, Riyadh. The lights were so good, the decorations and displays are so instagramable

There are booths where you can buy tickets for Games and rides. Games range from 10 to 50 SAR. You can buy a 50 SAR ticket or more. You can play some of the games and go on rides you like. The ticket is a wristband with a QR code.

There are a lot of food kiosks you'll not get worried about getting hungry. One of our favorites is the shawarma stall, affordable but so yummy.

Beware of the games you choose. Some of them are rigged

The stuffed toy prizes are of good quality Kids and adults young at heart will surely enjoy it there.

Overall, winter wonderland is a great experience for first-timers, but it’s something you only need to experience once. The novelty of it wears off quickly.

But we still enjoyed our first visit.",4.2,en,5 stars
"7039 العليا، 2808،، الغدير،, Riyadh 13311،, Saudi Arabia",Theme park,Riyadh,SA,False,True,Hamood ur Rahman,a year ago,2022-12-03T10:47:39.262Z,4.0,"Winter Wonderland has been innovatively built. The design and infrastructure of the carnival is commendable and fresh ideas are floating around the place. Good rides but a long waiting time. The price is very high in contrast to what we get in return. There is an entry ticket fee that actually covers nothing then onwards, the ticket for each ride is very high. They must think about cutting the ticket prices by 50% since there is an entry ticket to the carnival. By doing so, people will actually revisit more often.",4.2,en,4 stars
"7039 العليا، 2808،، الغدير،, Riyadh 13311،, Saudi Arabia",Theme park,Riyadh,SA,False,True,Emilija Morkunaite,a year ago,2023-01-21T17:50:11.684Z,3.0,"It was nice, but just that. Typical carnival experience that's all. Lots of space and not a lot of decorations. After the entrance fee- everything is extra. Rides are between 20-65 sar (5-16 usd) each which is a little too rich for my taste. If you don't have an extra 200 bucks to blow through, I wouldn't really bother going.",4.2,en,3 stars
"7039 العليا، 2808،، الغدير،, Riyadh 13311،, Saudi Arabia",Theme park,Riyadh,SA,False,True,Ahmad Sammour,3 years ago,2021-07-15T11:03:06.546Z,5.0,Amazing place to chill with friends other kids I cannot wait from them to open again one of the best memory very organized easy to find parking area I prefer to use Uber so easy to go in and  easy to leave Price very reasonable depends in which game you want also easy to win Prizes,4.2,en,5 stars
"7039 العليا، 2808،، الغدير،, Riyadh 13311،, Saudi Arabia",Theme park,Riyadh,SA,False,True,MG Francisco,a year ago,2023-02-21T15:47:01.007Z,4.0,"The best place to enjoy and bring all members of family and group of friends a team park offers

Dine in experience
Good memories
Amazing ambiances
Full of energetic people

Every rides was good and safe
But some of rides need parental Guidance..

You can enjoy every variaty of RIDES special the AIR MAXX HIGHLY RECOMMEND FOR ADVENTURER AND EXPLORER this ride give you memorable experience that you will come back and repeated again and again

There is also many small stall that you can play and try you luck .
And can win special prices .

There is also a lot of coffee shop such as WOOP that can give u best waffle on town .
And some places to eat
Everything you need was already inside
Even The TOILET was very accessible
Also no need to worry because there is MEDICAL TEAM STANDBY. EVERY CORNER .",4.2,en,5 stars
"7039 العليا، 2808،، الغدير،, Riyadh 13311،, Saudi Arabia",Theme park,Riyadh,SA,False,True,نايف العتيبي,a year ago,2022-10-13T10:25:54.815Z,5.0,"Hello

I visited the Winter in the middle of the week.

Its atmosphere is very beautiful and with winter it is more beautiful and beautiful.

They open in winter from 2 noon.

-I advise you to go early,

I arrived at 4 o’clock, there is no traffic and we enjoyed it, but after dinner it became crowded and everything needed a long class.

- Parking is free but far away.

And nearby parking paid at 10 riyals.

- There is music and they only get drunk at prayer time.

- There are many restaurants and cafes to suit all tastes.

- There are toilets and chapel for men and women.

(Wheap courses for wagon owners are very limited

+ There is no child care room, it is very difficult to change your child except in the course of water in front of people

- There is a smoking area and no smoking in others.

- There are ATMs, ambulances and an emergency medical center.

- The place is suitable for all age groups and there is not a requirement to play.

When we went, the clowns had their position because of Corona.",4.2,en,4 stars
"7039 العليا، 2808،، الغدير،, Riyadh 13311،, Saudi Arabia",Theme park,Riyadh,SA,False,True,Maryam B,a year ago,2022-11-23T22:39:21.772Z,4.0,"Its great to be able to have this experience within the heart of saudi 

The staff were very welcoming , ticking was easy through the website and tickets booths for the games inside were available at almost every corner.

They have a great variety of games wether you love the adrenaline rush or just here to have a chill time and play some arcades .

Also good food options with great shawerma , burgers, coffee and much more.

I honestly loved the wheel its a must try if you go.

As for the games they were a bit over priced with shorter than usual rounds.

Something I must mention was how clean and serviced the bathrooms were!

As for only downside to me was the fact that the only available entrance was the one for cars within the parking but the weather was nice so wasn’t that bad.",4.2,en,4 stars
"7039 العليا، 2808،، الغدير،, Riyadh 13311،, Saudi Arabia",Theme park,Riyadh,SA,False,True,Victoria Rice,a year ago,2023-01-17T18:27:34.513Z,5.0,"I had an amazing time with my kids! We went on rides, ate great food, and enjoyed the views! It is so clean everywhere here!",4.2,en,5 stars
"7039 العليا، 2808،، الغدير،, Riyadh 13311،, Saudi Arabia",Theme park,Riyadh,SA,False,True,Free Shereena,2 years ago,2022-03-16T04:38:31.475Z,3.0,"Crowded place, unorganized, too much noisy. You have to book before you come. Every ride has 2 lines, long line high price ticket and short line more expensive ticket. My advise to you: do not add much money in the ticket card, you will not be able to ride more than 4 rides in one day because of high prices and the crowds. It is more likely for kids and teenagers. The ticket card not refundable, so be carful when you recharge it. You can use the ticket card in Boulevard Riyadh City.",4.2,en,2 stars
"7039 العليا، 2808،، الغدير،, Riyadh 13311،, Saudi Arabia",Theme park,Riyadh,SA,False,True,Shuaib's World,a year ago,2022-12-23T21:43:24.963Z,5.0,"Lots of rides that’s so much enjoyable..
i love the place... if u have so much money then h can go & Obviously it’s a expensive place..",4.2,en,5 stars
"7039 العليا، 2808،، الغدير،, Riyadh 13311،, Saudi Arabia",Theme park,Riyadh,SA,False,True,Farouk Kassem,2 years ago,2021-12-28T05:22:23.284Z,4.0,"Costy some how , specially if it's a big family ,
Regular parking 10sr per hour and there's vip for 300sr , Entrance 55 sr , games 25-30-55 , zombie house 55sr and it's worthy very nice experience , there's some games it wasn't working because it needs maintenance ...",4.2,en,3 stars
"7039 العليا، 2808،، الغدير،, Riyadh 13311،, Saudi Arabia",Theme park,Riyadh,SA,False,True,Mohammed Alghasham,a year ago,2022-12-15T03:04:57.871Z,5.0,"Amazing place we enjoyed there.
Try Ur best to get each and every zone, each of them has a unique experience",4.2,en,5 stars
"7039 العليا، 2808،، الغدير،, Riyadh 13311،, Saudi Arabia",Theme park,Riyadh,SA,False,True,vhyncenzo agorab (Vhyncenzo),2 years ago,2021-12-05T13:20:26.535Z,5.0,"Its the SEASON here in RIYADH that we are waiting for and finally after year of waiting WINTER WONDERLAND open again. It a place good to Enjoy Rides, Games and picture taking. Enjoy the cool breeze weather with amazing lightings around.",4.2,en,5 stars
"7039 العليا، 2808،، الغدير،, Riyadh 13311،, Saudi Arabia",Theme park,Riyadh,SA,False,True,S waheed,a year ago,2023-01-03T02:26:43.786Z,5.0,It’s a fun extravaganza that you do not wanna miss with thrilling and soul chilling rides and an amazing Birds Eye view of city from ferrous wheel… it has everything for everyone. You can see it as an art work…,4.2,en,5 stars
"7039 العليا، 2808،، الغدير،, Riyadh 13311،, Saudi Arabia",Theme park,Riyadh,SA,False,True,JUNIE S. (EXPLORER),a year ago,2022-11-08T22:35:19.748Z,5.0,"All i can say is…. SUPERB ☺️…
I enjoyed so much, The delicious foods , Amazing Place ⛲️and People‍, and those Wonderful Rides . Its more Fun in Winter Wonderland Land  ❤️",4.2,en,5 stars
"7039 العليا، 2808،، الغدير،, Riyadh 13311،, Saudi Arabia",Theme park,Riyadh,SA,False,True,Dhana sekaran,2 years ago,2022-04-02T05:15:19.048Z,5.0,"On last day 31/03/2022 we visited with family.

Very nice place fir family entertainment.
But i feel not affordable for all, in terms of price. It's better we decide by ourselves before visit there",4.2,en,2 stars
"7039 العليا، 2808،، الغدير،, Riyadh 13311،, Saudi Arabia",Theme park,Riyadh,SA,False,True,Dahlia P. Bongtiwon,a year ago,2023-02-14T09:05:00.760Z,5.0,"One of the best. Ticket for the rides are a bit pricey but the experience is worth it.❤️❤️
See you next year #Winterwonderland.",4.2,en,5 stars
"7039 العليا، 2808،، الغدير،, Riyadh 13311،, Saudi Arabia",Theme park,Riyadh,SA,False,True,soha angel12,a year ago,2022-12-28T21:46:45.689Z,4.0,We got fun. The rides price is nearly as sparkys. the extrme rides are 40riyal each and others are 20,4.2,en,4 stars
"Hittin, Riyadh 13516, Saudi Arabia",Tourist attraction,Riyadh,SA,False,True,k k,2 weeks ago,2024-09-18T18:59:20.252Z,5.0,Really loved it. Great walk and a lot of food places,4.6,en,5 stars
"Hittin, Riyadh 13516, Saudi Arabia",Tourist attraction,Riyadh,SA,False,True,Amna Tanveer,3 months ago,2024-07-02T22:55:36.572Z,5.0,Wonderful place with lots of fun and entertainment. Highly recommended.,4.6,en,5 stars
"Hittin, Riyadh 13516, Saudi Arabia",Tourist attraction,Riyadh,SA,False,True,Ar Em,7 months ago,2024-02-07T20:48:01.042Z,5.0,A great leisure complex and upscale trendy dining options with a wonderful dancing fountain show on the hour.  Visited during January 2024 Riyadh Season.  Nice cool winter weather.  Highly recommended.,4.6,en,5 stars
"Hittin, Riyadh 13516, Saudi Arabia",Tourist attraction,Riyadh,SA,False,True,hawra alnabi,4 months ago,2024-05-05T17:21:53.917Z,5.0,"Very beautiful place with lots to see and do.
Lots of cafes and restaurants. Very fun place to walk.",4.6,en,5 stars
"Hittin, Riyadh 13516, Saudi Arabia",Tourist attraction,Riyadh,SA,False,True,Ezekiel,8 months ago,2024-01-06T10:13:23.656Z,5.0,"Absolutely worth going!!! The food, the people, the atmosphere, it’s all very amazing! Whenever in Riyadh, this place is a must. It is absolutely amazing you can try you can taste and you can see so many things in one area. I was only here for one week, but it was so worth coming.",4.6,en,5 stars
"Hittin, Riyadh 13516, Saudi Arabia",Tourist attraction,Riyadh,SA,False,True,Hassan Ali,8 months ago,2024-01-24T07:51:02.574Z,5.0,A really fun place to visit with family. Free entrance. Food court area and also high end restaurants. Many paid activities. Wonderful fountain show. Must visit!,4.6,en,5 stars
"Hittin, Riyadh 13516, Saudi Arabia",Tourist attraction,Riyadh,SA,False,True,Manar Malaikah,6 months ago,2024-03-09T09:12:58.477Z,5.0,"Blvd City (formerly Boulevard Riyadh City) is a one-stop shop for entertainment and leisure in Riyadh. Here's a look at what this sprawling complex offers:

Retail Therapy and Culinary Delights:  Indulge in some retail therapy at BLVD Square, featuring high-end stores and international brands. Craving a delicious meal? Blvd City boasts a vast selection of restaurants, cafes, and fast-food joints, catering to all tastes and budgets.

Entertainment Extravaganza:  Get ready for a fun-filled experience!  Blvd City offers a variety of entertainment options, including:

Themed Zones: Explore unique areas like the Garden with its theaters and cafes, or the pulsating energy of the District with its arcades and VR experiences.
Family Fun: Take a trip down memory lane at the wax museum, or enjoy a movie at the largest cinema in the Middle East. Little ones will love the dedicated play areas.
Live Shows and Events: Catch live performances, musical acts, and exciting events happening throughout the year. (Check the Riyadh Season website for current offerings!)
A Few Things to Consider:

Free Entry: While entry to Blvd City is free, some attractions and events may require separate tickets.
Year-Round Fun: Although Blvd City is a major part of the Riyadh Season, some elements are open year-round, so check their website for details.
Getting There: Located in the Hittin district, Blvd City is easily accessible by car.
Overall, Blvd City is a vibrant and dynamic entertainment destination in Riyadh. It offers something for everyone, from shopping and dining to thrilling rides and live shows.  Whether you're a local or a visitor, Blvd City is sure to provide a memorable and enjoyable experience.",4.6,en,4 stars
"Hittin, Riyadh 13516, Saudi Arabia",Tourist attraction,Riyadh,SA,False,True,Liyaanaa Shah Alam,5 months ago,2024-04-17T07:00:23.413Z,5.0,It was fun to go there with family .my 1.5 year old infant enjoyed the environment of the city . We clicked a family pic and few pics for memories had fun,4.6,en,4 stars
"Hittin, Riyadh 13516, Saudi Arabia",Tourist attraction,Riyadh,SA,False,True,Aqeel Ahmad,3 months ago,2024-06-09T15:34:11.838Z,4.0,"Best place to visit in Riyadh, I was not aware of this place until I saw post about it on social media.
A lot of activities happening here,it’s good place for families to explore best experience.",4.6,en,5 stars
"Hittin, Riyadh 13516, Saudi Arabia",Tourist attraction,Riyadh,SA,False,True,FAYIZ ABOOBACKER,3 months ago,2024-06-08T07:10:31.879Z,5.0,"Boulevard City in Riyadh was like entering a lively oasis amidst the urban hustle. Amidst the towering structures and bustling streets, this vibrant space offered a breath of fresh air and a moment of serenity.",4.6,en,5 stars
"Hittin, Riyadh 13516, Saudi Arabia",Tourist attraction,Riyadh,SA,False,True,Rubil Sleem,a year ago,2023-05-27T14:01:03.750Z,5.0,"I had an amazing time at this place! The stunning scenery and friendly atmosphere made it the perfect spot for a family outing. We enjoyed walking around freely and taking in the mesmerizing water fountain show with its beautiful choreography that danced to the sound of the music. Overall, it was a fantastic experience that I would highly recommend.""",4.6,en,5 stars
"Hittin, Riyadh 13516, Saudi Arabia",Tourist attraction,Riyadh,SA,False,True,Ashik Richu,a week ago,2024-09-23T19:28:06.523Z,5.0,Very Nice place . I can't believe such a place is existing in Saudi,4.6,en,4 stars
"Hittin, Riyadh 13516, Saudi Arabia",Tourist attraction,Riyadh,SA,False,True,Kenshin89,3 months ago,2024-06-12T04:00:49.975Z,5.0,Great experience at the place and great to be back in there again and very much enjoyed it and thank you so much again.,4.6,en,5 stars
"Hittin, Riyadh 13516, Saudi Arabia",Tourist attraction,Riyadh,SA,False,True,Sohaib Shaheen,6 months ago,2024-03-08T14:07:22.962Z,5.0,"If you have just enough time to visit one place in Riyadh, visit this time. Entire area looks out of this world, there is a shopping and eating area in Blvd City while few meters away there is Blvd World with huge selection of rides and then it also has a theatre.

Pics don’t do justice to the vibe of this area. Every nook and every cranny has been carefully planned to grab attention from enormous fish tanks to 3d screens and burning spheres, it’s all a sigh to behold. There are plenty of food options to kill time and multiple gaming zones to keep kids busy.",4.6,en,2 stars
